{
  "schema_version": "claim-packet-v1",
  "question": {
    "id": "GQ-008:cache-block",
    "text": "Which available model should own each recurring work shape after quality, reliability, tool use, latency, quota, and cost are evaluated together?",
    "scope": "cost dimension \u2014 where prompt caching is lost on the MiniMax path",
    "parents": [
      "GQ-008"
    ]
  },
  "claim": {
    "id": "claim:GQ-008.cache-economics.v2",
    "position": "MiniMax's zero cache rate is a gateway defect, not a provider limitation. Re-run on demand 2026-08-04: an identical request with cache_control reads a non-zero number of prompt tokens from cache through the local proxy and EXACTLY ZERO through Bifrost, on every run. The proxy figure varies with cache entry age \u2014 observed 2,944 of 3,033 originally, then 1,024, 128 and 1,024 of 1,078 on later runs \u2014 so treat any single magnitude as a point observation. The zero does not vary. The cheap lane's cost disadvantage is therefore recoverable by fixing the routing path rather than by changing which model owns the work.",
    "confidence": 0.88,
    "status": "proposed",
    "created_at": "2026-08-04T04:25:34Z",
    "updated_at": "2026-08-04T14:30:57Z",
    "supersedes": [
      "claim:GQ-008.cache-economics.v1"
    ]
  },
  "grounding": [
    {
      "quote": "\"cached_tokens\": 2944",
      "source": {
        "kind": "external",
        "id": "metrics/2026-08-04-gq008-cache-block-isolated.json",
        "title": "Cache block isolated to Bifrost"
      },
      "locator": "results[0].cached_tokens",
      "passage_id": "gq008:proxy-caches",
      "byte_range": {
        "start": 385,
        "end": 406
      }
    },
    {
      "quote": "\"cache_works\": false",
      "source": {
        "kind": "external",
        "id": "metrics/2026-08-04-gq008-cache-block-isolated.json",
        "title": "Cache block isolated to Bifrost"
      },
      "locator": "results[1].cache_works",
      "passage_id": "gq008:bifrost-blocks",
      "byte_range": {
        "start": 548,
        "end": 568
      }
    },
    {
      "quote": "\"bifrost_arm\": \"0 cached on every run without exception",
      "source": {
        "kind": "external",
        "id": "metrics/2026-08-04-gq008-rerun-variance.json",
        "title": "GQ-008 experiment re-run on demand, with cache-age variance measured"
      },
      "locator": "bifrost_arm",
      "passage_id": "gq008:bifrost-flat-zero",
      "byte_range": {
        "start": 1157,
        "end": 1212
      }
    },
    {
      "quote": "\"proxy_cached\": 1024",
      "source": {
        "kind": "external",
        "id": "metrics/2026-08-04-gq008-rerun-variance.json",
        "title": "GQ-008 experiment re-run on demand, with cache-age variance measured"
      },
      "locator": "reruns[1].proxy_cached",
      "passage_id": "gq008:proxy-rerun",
      "byte_range": {
        "start": 356,
        "end": 376
      }
    }
  ],
  "action": {
    "status": "proposed",
    "description": "Route MiniMax traffic through the local proxy rather than Bifrost, or fix Bifrost's cache_control forwarding. Measured saving on a 3,033-token prompt is 2,944 cached tokens per repeated call. This changes gateway topology and is not a librarian decision.",
    "owner": "librarian"
  },
  "refresh": {
    "strategy": "on-evidence-change",
    "selectors": [
      "GQ-008",
      "routing",
      "cache-economics",
      "bifrost"
    ],
    "invalidate_on": [
      "schema change",
      "new evidence source",
      "approved action status change"
    ]
  },
  "provenance": {
    "producer": "siso-librarian",
    "run_id": "GQ-008-loop-2026-08-04-cache-block",
    "model": "claude-opus-5",
    "generated_at": "2026-08-04T04:25:34Z"
  }
}
