{
  "schema_version": "claim-packet-v1",
  "question": {
    "id": "GQ-009:claim-layer",
    "text": "How should the Library expose answer-shaped claims without becoming the corpus warehouse or execution runtime?",
    "scope": "registry-facing claim handoff contract",
    "parents": ["GQ-009"]
  },
  "claim": {
    "id": "claim:GQ-009.claim-layer.contract.v2",
    "position": "The claim packet contract holds up under load: a question-driven registry can bind claims to evidence, freshness and action without warehousing corpus or running execution, and the layer's weak point is not its shape but whether freshness is derived rather than asserted.",
    "confidence": 0.81,
    "status": "accepted",
    "created_at": "2026-08-04T01:10:00Z",
    "updated_at": "2026-08-04T01:10:00Z",
    "supersedes": ["claim:GQ-009.claim-layer.contract"]
  },
  "grounding": [
    {
      "quote": "\"required_rights\": \"public domain\"",
      "source": {
        "kind": "source_inventory",
        "id": "sources/internet-archive/adapter-contract.json",
        "title": "Internet Archive adapter contract"
      },
      "locator": "legal_filter.required_rights",
      "passage_id": "ia-contract:legal_filter",
      "byte_range": { "start": 1086, "end": 1120 }
    },
    {
      "quote": "\"numFound_live\": 1367676",
      "source": {
        "kind": "external",
        "id": "metrics/2026-08-03-ia-live-metadata-probe-combined.json",
        "title": "Internet Archive live metadata probe"
      },
      "locator": "search.numFound_live",
      "passage_id": "ia-probe:numFound",
      "byte_range": { "start": 195, "end": 219 }
    },
    {
      "quote": "a hand-written assertion",
      "source": {
        "kind": "external",
        "id": "worklog/2026-08-04-0100-refresh-ledger-earns-its-claim.md",
        "title": "Refresh ledger drift finding"
      },
      "locator": "the-gap",
      "passage_id": "refresh-worklog:assertion",
      "byte_range": { "start": 376, "end": 400 }
    }
  ],
  "action": {
    "status": "done",
    "description": "Adopt claim-packet-v1 as the public handoff shape, with freshness derived mechanically by scripts/evaluate-refresh.mjs rather than asserted in the ledger.",
    "owner": "librarian",
    "artifact": "scripts/evaluate-refresh.mjs"
  },
  "refresh": {
    "strategy": "question-loop",
    "selectors": ["GQ-009", "claim-layer", "evidence-selection", "refresh-derivation"],
    "invalidate_on": ["schema change", "new evidence source", "approved action status change"]
  },
  "provenance": {
    "producer": "siso-librarian",
    "run_id": "GQ-009-loop-2026-08-04-regrounding",
    "model": "claude-opus-5",
    "generated_at": "2026-08-04T01:10:00Z"
  }
}
