{
  "schema_version": "claim-packet-v1",
  "question": {
    "id": "GQ-001:enforcement-limits",
    "text": "How should the complete agent workspace be designed across code layout, agent architecture, memory, enforcement, and agent-generated user interfaces?",
    "scope": "the enforcement and memory layers, measured over one continuous session",
    "parents": [
      "GQ-001"
    ]
  },
  "claim": {
    "id": "claim:GQ-001-enforcement-limits-v2",
    "position": "Gates became a real enforcement boundary on 2026-08-05, and the same day showed the boundary's own blind spot. GQ-001 v1 measured that the gates had blocked ZERO pushes and concluded they were 'a pre-commit convention rather than an enforcement boundary'. That no longer holds: a pre-push hook REFUSED an actual push today, correctly, on a genuine 200-book gap between the corpus index and the texts on disk. Every count in v1 has also moved \u2014 6 gates to 11, 14 self-test cases to 15, 2 probes to 8. The sharper finding is what enforcement still cannot see. Five defects fixed today shared one shape the entire gate layer was blind to: the input was ABSENT rather than WRONG, and each checker answered as though absent meant fine. mktemp failed silently so a logfile variable became the empty string, making an OCR-skip branch unreachable and failing a correct corpus. A retention job pointed at a file containing the literal text 'not a database' printed 'rows total: unknown' and then 'nothing to do' and exited 0. A coverage audit reported findings [] with checked_files: 0 \u2014 its own output carried the evidence and nothing acted on it. Every self-test case broke artifacts by making them WRONG; not one removed an input entirely, so all five would have passed the suite. Worst, six probes in that suite printed PASS and FAIL into a void: forcing a FAIL still produced '15 passed, 0 failed' and exit 0, because the probes are subshells and the counters lived only in check(). For their whole existence those probes were decorative \u2014 the same defect they exist to catch, inside the tool used to catch it. So the limit is not that gates miss what only execution finds, as v1 had it; it is that a gate's INPUT is unguarded. A checker proves nothing about its own reachability, and a verdict nobody counts is indistinguishable from a verdict that passed. Fixed by adding starvation cases alongside corruption cases, making all 8 probes exit non-zero and be counted (23 passed / 0 failed healthy; 22/1 and exit 1 when one is forced), and making three checkers refuse on empty rather than default to zero.",
    "confidence": 0.81,
    "status": "proposed",
    "created_at": "2026-08-05T00:00:00Z",
    "updated_at": "2026-08-05T00:00:00Z",
    "supersedes": [
      "claim:GQ-001.enforcement-limits.v1"
    ]
  },
  "grounding": [
    {
      "quote": "PUSH REFUSED",
      "source": {
        "kind": "external",
        "id": "metrics/2026-08-05-the-hook-was-right.json",
        "title": "The hook was right"
      },
      "locator": "hook.refusal",
      "passage_id": "gq001-v2:refusal",
      "byte_range": {
        "start": 419,
        "end": 431
      }
    },
    {
      "quote": "decorative for their entire existence",
      "source": {
        "kind": "external",
        "id": "metrics/2026-08-05-probes-that-printed-into-a-void.json",
        "title": "Probes that printed into a void"
      },
      "locator": "probes.decorative",
      "passage_id": "gq001-v2:probes",
      "byte_range": {
        "start": 1066,
        "end": 1103
      }
    },
    {
      "quote": "EMPTY STRING",
      "source": {
        "kind": "external",
        "id": "metrics/2026-08-05-the-guard-that-could-not-fire.json",
        "title": "The guard that could not fire"
      },
      "locator": "mktemp.empty",
      "passage_id": "gq001-v2:mktemp",
      "byte_range": {
        "start": 877,
        "end": 889
      }
    },
    {
      "quote": "nothing to do",
      "source": {
        "kind": "external",
        "id": "metrics/2026-08-05-success-against-a-corrupt-database.json",
        "title": "Success against a corrupt database"
      },
      "locator": "retention.silent",
      "passage_id": "gq001-v2:retention",
      "byte_range": {
        "start": 507,
        "end": 520
      }
    },
    {
      "quote": "checked_files: 0",
      "source": {
        "kind": "external",
        "id": "metrics/2026-08-05-a-gate-that-examined-nothing.json",
        "title": "A gate that examined nothing"
      },
      "locator": "coverage.vacuous",
      "passage_id": "gq001-v2:coverage",
      "byte_range": {
        "start": 439,
        "end": 455
      }
    }
  ],
  "action": {
    "status": "done",
    "description": "Guard the INPUT of every checker, not only its output: starvation cases beside corruption cases, probe verdicts counted, and refusal rather than a zero default when a source cannot be read.",
    "owner": "siso-librarian",
    "artifact": "scripts/gate-selftest.sh"
  },
  "refresh": {
    "strategy": "question-loop",
    "selectors": [
      "GQ-001",
      "enforcement",
      "gate-self-test",
      "starvation",
      "probe-counting"
    ],
    "invalidate_on": [
      "verify chain change",
      "self-test case count change",
      "a push blocked or not blocked by the hook"
    ]
  },
  "provenance": {
    "producer": "siso-librarian",
    "run_id": "GQ-001-loop-2026-08-05-starvation",
    "model": "claude-opus-5",
    "generated_at": "2026-08-05T00:00:00Z"
  }
}
