{
  "schema_version": "claim-packet-v1",
  "question": {
    "id": "GQ-001:enforcement-limits",
    "text": "How should the complete agent workspace be designed across code layout, agent architecture, memory, enforcement, and agent-generated user interfaces?",
    "scope": "the enforcement and memory layers, measured over one continuous session",
    "parents": [
      "GQ-001"
    ]
  },
  "claim": {
    "id": "claim:GQ-001.enforcement-limits.v1",
    "position": "Automated gates and execution catch different classes of defect and neither substitutes for the other: over one session with three gates, 3 defects were caught by a gate and 6 only by running something. Gates detect drift between a recorded value and its source; they are blind to code that does not do what its description claims, to a wrong path shared by producer and checker, and to a diagnosis naming the wrong layer. A workspace that invests only in gates will pass while being wrong.",
    "confidence": 0.58,
    "status": "proposed",
    "created_at": "2026-08-04T05:01:45Z",
    "updated_at": "2026-08-04T05:01:45Z",
    "supersedes": []
  },
  "grounding": [
    {
      "quote": "\"defects_caught_by_a_gate\": 3",
      "source": {
        "kind": "external",
        "id": "metrics/2026-08-04-gq001-workspace-enforcement.json",
        "title": "Workspace enforcement, measured over one session"
      },
      "locator": "enforcement.defects_caught_by_a_gate",
      "passage_id": "gq001:gate-caught",
      "byte_range": {
        "start": 535,
        "end": 564
      }
    },
    {
      "quote": "\"defects_caught_only_by_execution\": 6",
      "source": {
        "kind": "external",
        "id": "metrics/2026-08-04-gq001-workspace-enforcement.json",
        "title": "Workspace enforcement, measured over one session"
      },
      "locator": "enforcement.defects_caught_only_by_execution",
      "passage_id": "gq001:execution-caught",
      "byte_range": {
        "start": 570,
        "end": 607
      }
    },
    {
      "quote": "\"automated_gates\": 3",
      "source": {
        "kind": "external",
        "id": "metrics/2026-08-04-gq001-workspace-enforcement.json",
        "title": "Workspace enforcement, measured over one session"
      },
      "locator": "enforcement.automated_gates",
      "passage_id": "gq001:gate-count",
      "byte_range": {
        "start": 325,
        "end": 345
      }
    }
  ],
  "action": {
    "status": "proposed",
    "description": "Stop adding gates at three. The marginal gate checks another recorded value; the marginal execution test checks whether something works. For a standing agent the higher-yield investment is a habit of running changed code against a copy, which caught the auth defect, the SIP block, and the misattributed cache diagnosis that no gate could see.",
    "owner": "librarian"
  },
  "refresh": {
    "strategy": "on-evidence-change",
    "selectors": [
      "GQ-001",
      "workspace",
      "enforcement",
      "gates"
    ],
    "invalidate_on": [
      "schema change",
      "new evidence source",
      "approved action status change"
    ]
  },
  "provenance": {
    "producer": "siso-librarian",
    "run_id": "GQ-001-loop-2026-08-04-enforcement-limits",
    "model": "claude-opus-5",
    "generated_at": "2026-08-04T05:01:45Z"
  }
}
