{
  "schema_version": "claim-packet-v1",
  "question": {
    "id": "GQ-002:caching-multiplier",
    "text": "What changes would make the complete provider-neutral SISO agent layer ten times more effective per unit of time, attention, and compute?",
    "scope": "compute dimension \u2014 output returned per billed input token on this gateway",
    "parents": [
      "GQ-002"
    ]
  },
  "claim": {
    "id": "claim:GQ-002.caching-multiplier.v1",
    "position": "Prompt caching is a large multiplier on compute effectiveness, but it is not the largest: the dominant variable is how much context a lane ships. Re-derived 2026-08-04 across 408, 1,553 and 181 requests, CodexOpenAI returns 85.86 output tokens per 1,000 billed input against Anthropic's 16.38 \u2014 a 5.2x spread (was 6.8x at lower volume). But MiniMax at 0% cache returns 25.31, BEATING Anthropic at 93% cache, which a pure cache-rate mechanism cannot explain. MiniMax ships 22,367 input tokens per request against Anthropic's 524,572. Caching is the second-order correction on a large context, not a substitute for having a small one.",
    "confidence": 0.79,
    "status": "proposed",
    "created_at": "2026-08-04T04:50:29Z",
    "updated_at": "2026-08-04T14:20:45Z",
    "supersedes": []
  },
  "grounding": [
    {
      "quote": "\"ratio\": 6.8",
      "source": {
        "kind": "external",
        "id": "metrics/2026-08-04-gq002-effectiveness-per-compute.json",
        "title": "Effectiveness per unit compute, measured"
      },
      "locator": "spread.ratio",
      "passage_id": "gq002:spread",
      "byte_range": {
        "start": 1536,
        "end": 1548
      }
    },
    {
      "quote": "\"output_per_1k_billed_input\": 25.09",
      "source": {
        "kind": "external",
        "id": "metrics/2026-08-04-gq002-effectiveness-per-compute.json",
        "title": "Effectiveness per unit compute, measured"
      },
      "locator": "providers[].output_per_1k_billed_input (Minimax)",
      "passage_id": "gq002:minimax-rate",
      "byte_range": {
        "start": 860,
        "end": 895
      }
    },
    {
      "quote": "\"spread_now\": \"5.2x (was 6.8x)",
      "source": {
        "kind": "external",
        "id": "metrics/2026-08-04-gq002-rederived.json",
        "title": "GQ-002 re-derived from the gateway log, independent of its own metrics"
      },
      "locator": "rederived.spread_now",
      "passage_id": "gq002:spread-rederived",
      "byte_range": {
        "start": 853,
        "end": 883
      }
    },
    {
      "quote": "\"Minimax\": 22367",
      "source": {
        "kind": "external",
        "id": "metrics/2026-08-04-gq002-rederived.json",
        "title": "GQ-002 re-derived from the gateway log, independent of its own metrics"
      },
      "locator": "what_actually_drives_it.avg_input_tokens_per_request.Minimax",
      "passage_id": "gq002:context-size",
      "byte_range": {
        "start": 1352,
        "end": 1368
      }
    }
  ],
  "action": {
    "status": "proposed",
    "description": "Before evaluating model swaps for the 10x goal, fix caching where it is absent. The MiniMax path alone would move from 25.09 to a rate bounded by its 97% cache capability \u2014 a larger gain than any model substitution available on this gateway, and scripts/minimax-cache-route.sh already implements it reversibly.",
    "owner": "librarian"
  },
  "refresh": {
    "strategy": "on-evidence-change",
    "selectors": [
      "GQ-002",
      "effectiveness",
      "caching",
      "compute"
    ],
    "invalidate_on": [
      "schema change",
      "new evidence source",
      "approved action status change"
    ]
  },
  "provenance": {
    "producer": "siso-librarian",
    "run_id": "GQ-002-loop-2026-08-04-caching-multiplier",
    "model": "claude-opus-5",
    "generated_at": "2026-08-04T04:50:29Z"
  }
}
