{
  "schema_version": "claim-packet-v1",
  "question": {
    "id": "GQ-009:claim-layer",
    "text": "How should the Library expose answer-shaped claims without becoming the corpus warehouse or execution runtime?",
    "scope": "registry-facing claim handoff contract",
    "parents": ["GQ-009"]
  },
  "claim": {
    "id": "claim:GQ-009.claim-layer.contract",
    "position": "The Library needs a small claim packet contract that binds a question to selected quotes, confidence, refresh rules, and an approved action pointer.",
    "confidence": 0.72,
    "status": "proposed",
    "created_at": "2026-08-03T00:00:00Z",
    "updated_at": "2026-08-03T00:00:00Z",
    "supersedes": []
  },
  "grounding": [
    {
      "quote": "Extraction does not scale. Evidence selection MUST be question-driven.",
      "source": {
        "kind": "external",
        "id": "AGENT_PACKET:GQ-009:2026-08-03",
        "title": "GQ-009 standing packet"
      },
      "locator": "constraint-that-shapes-everything",
      "passage_id": "packet:GQ-009:constraint",
      "byte_range": { "start": 0, "end": 74 }
    }
  ],
  "action": {
    "status": "proposed",
    "description": "Adopt claim-packet-v1 as the public handoff shape for question-driven claim work.",
    "owner": "librarian",
    "artifact": "schemas/claim-packet-v1.schema.json"
  },
  "refresh": {
    "strategy": "question-loop",
    "selectors": ["GQ-009", "claim-layer", "evidence-selection"],
    "invalidate_on": ["schema change", "new evidence source", "approved action status change"]
  },
  "provenance": {
    "producer": "siso-librarian",
    "run_id": "GQ-009-loop-2026-08-03-claim-layer-contract",
    "model": "claude-opus-5",
    "generated_at": "2026-08-03T00:00:00Z"
  }
}
