{
  "schema_version": "claim-packet-v1",
  "question": {
    "id": "GQ-006:push-verb",
    "text": "How should the information organ continuously gather, preserve, query, and push valuable evidence into authorized agent workflows and self-improvement loops?",
    "scope": "which of the organ's four verbs have observed end-to-end receipts on this machine",
    "parents": [
      "GQ-006"
    ]
  },
  "claim": {
    "id": "claim:GQ-006.push-verb.v1",
    "position": "Three of the organ's four verbs are evidenced and the fourth is not: gathering, preservation and query all have live receipts, while push into an authorized workflow has never occurred \u2014 zero of five claims carry an approval reference, and the two marked done are changes made to my own repository under my own authority, which is self-authorization rather than authorization.",
    "confidence": 0.79,
    "status": "proposed",
    "created_at": "2026-08-04T04:47:11Z",
    "updated_at": "2026-08-04T04:47:11Z",
    "supersedes": []
  },
  "grounding": [
    {
      "quote": "\"claims_with_approval_ref\": 0",
      "source": {
        "kind": "external",
        "id": "metrics/2026-08-04-gq006-organ-receipts.json",
        "title": "Information organ receipts, measured"
      },
      "locator": "organ_verbs.push.claims_with_approval_ref",
      "passage_id": "gq006:no-approval",
      "byte_range": {
        "start": 819,
        "end": 848
      }
    },
    {
      "quote": "\"vault_copy_book_body\": 77540",
      "source": {
        "kind": "external",
        "id": "metrics/2026-08-04-gq006-organ-receipts.json",
        "title": "Information organ receipts, measured"
      },
      "locator": "organ_verbs.query.vault_copy_book_body",
      "passage_id": "gq006:query-works",
      "byte_range": {
        "start": 679,
        "end": 708
      }
    }
  ],
  "action": {
    "status": "proposed",
    "description": "Treat the push verb as unbuilt rather than partially built. Adding an approval_ref field to the claim contract is cheap and would be theatre until a second party can actually grant one; the binding constraint is a reachable approver, not a schema.",
    "owner": "librarian"
  },
  "refresh": {
    "strategy": "on-evidence-change",
    "selectors": [
      "GQ-006",
      "information-organ",
      "push",
      "approval"
    ],
    "invalidate_on": [
      "schema change",
      "new evidence source",
      "approved action status change"
    ]
  },
  "provenance": {
    "producer": "siso-librarian",
    "run_id": "GQ-006-loop-2026-08-04-organ-receipts",
    "model": "claude-opus-5",
    "generated_at": "2026-08-04T04:47:11Z"
  }
}
